[
  {
    "classifications": {
      "cwe": [
        "CWE-693"
      ],
      "owasp": [
        "OWASP ASVS V14.4"
      ]
    },
    "confidence": "high",
    "evidence": [
      {
        "id": "p3_1_curated.low_signal_informational.candidate.redacted_http_exchange",
        "kind": "http_exchange",
        "redacted": true,
        "sha256": "abcdef0123456789abcdef0123456789abcdef0123456789abcdef0123456789"
      }
    ],
    "id": "p3_1_curated.low_signal_informational.candidate",
    "references": [
      "https://owasp.org/www-project-secure-headers/"
    ],
    "remediation": "Synthetic fixture only: add a human-authored remediation note after authorized manual review; do not draft a submission from this candidate.",
    "schema_version": "finding/1.0",
    "severity_hint": "info",
    "source": {
      "module_id": "p3_1_curated.low_signal_informational",
      "policy_decision_sha256": "abcdef0123456789abcdef0123456789abcdef0123456789abcdef0123456789",
      "run_id": "p3-1-curated-low_signal_informational"
    },
    "status": "candidate",
    "summary": "Synthetic observation is informational and proves only benign metadata exposure, so it must remain below reportability.",
    "target": {
      "type": "domain",
      "value": "low-signal.example.test"
    },
    "title": "P3.1 synthetic low-signal informational candidate",
    "triage": {
      "manual_verification_required": true,
      "scanner_output_only": true
    },
    "verification_guidance": "Synthetic fixture only: treat as informational unless a human documents concrete security impact."
  }
]
