[
  {
    "classifications": {
      "cwe": [
        "CWE-693"
      ],
      "owasp": [
        "OWASP ASVS V14.4"
      ]
    },
    "confidence": "low",
    "evidence": [
      {
        "id": "review_packet_self_test.low_confidence.http_excerpt",
        "kind": "http_exchange",
        "redacted": true,
        "sha256": "9ce788a4aa62fa31dff68c49eac173923524875e0c3fd4ccd8e29fd545bed388"
      }
    ],
    "id": "review_packet_self_test.low_confidence.candidate",
    "references": [
      "https://owasp.org/www-project-secure-headers/"
    ],
    "remediation": "Self-test fixture: confidence is low, so report_readiness must remain not_ready even with an evidence ref.",
    "schema_version": "finding/1.0",
    "severity_hint": "medium",
    "source": {
      "module_id": "self_test.candidate_review_packet",
      "policy_decision_sha256": "0123456789abcdef0123456789abcdef0123456789abcdef0123456789abcdef",
      "run_id": "self-test.candidate-review-packet"
    },
    "status": "candidate",
    "summary": "Self-test fixture exercising the not_ready branch caused by confidence == low and the confidence_floor review question.",
    "target": {
      "type": "domain",
      "value": "selftest.example.test"
    },
    "title": "Self-test: low confidence not ready",
    "triage": {
      "manual_verification_required": true,
      "scanner_output_only": true
    },
    "verification_guidance": "Self-test fixture only: raise confidence or keep this candidate off the draft."
  }
]
